{"$schema":"https://json-schema.org/draft/2020-12/schema","additionalProperties":false,"properties":{"acknowledged_penalty":{"const":0.25,"default":0.25,"title":"Acknowledged Penalty","type":"number"},"b":{"const":0.75,"default":0.75,"title":"B","type":"number"},"bm25_weight":{"const":0.75,"default":0.75,"title":"Bm25 Weight","type":"number"},"body_jaccard":{"default":0.95,"maximum":1,"minimum":0,"title":"Body Jaccard","type":"number"},"config_revision":{"default":"pr4-baselines-v1","enum":["pr3-baselines-v1","pr4-baselines-v1"],"title":"Config Revision","type":"string"},"grouping_revision":{"const":"conservative-v1","default":"conservative-v1","title":"Grouping Revision","type":"string"},"half_life_days":{"const":7,"default":7,"title":"Half Life Days","type":"integer"},"included_penalty":{"const":0.1,"default":0.1,"title":"Included Penalty","type":"number"},"k1":{"const":1.2,"default":1.2,"title":"K1","type":"number"},"metric_k":{"const":5,"default":5,"title":"Metric K","type":"integer"},"min_body_tokens":{"default":12,"exclusiveMinimum":0,"title":"Min Body Tokens","type":"integer"},"query_revision":{"const":"persona-query-v1","default":"persona-query-v1","title":"Query Revision","type":"string"},"random_seed":{"const":0,"default":0,"title":"Random Seed","type":"integer"},"recency_weight":{"const":0.25,"default":0.25,"title":"Recency Weight","type":"number"},"registered_budgets":{"default":[180,420,900],"items":{"enum":[180,420,900],"type":"integer"},"title":"Registered Budgets","type":"array"},"registered_half_lives":{"default":[3,7,14],"items":{"enum":[3,7,14],"type":"integer"},"title":"Registered Half Lives","type":"array"},"rendered_penalty":{"const":0.1,"default":0.1,"title":"Rendered Penalty","type":"number"},"retrieval_sha256":{"anyOf":[{"pattern":"^[0-9a-f]{64}$","type":"string"},{"type":"null"}],"default":null,"title":"Retrieval Sha256"},"score_decimals":{"const":5,"default":5,"title":"Score Decimals","type":"integer"},"title_jaccard":{"default":0.8,"maximum":1,"minimum":0,"title":"Title Jaccard","type":"number"},"title_weight":{"const":2,"default":2,"title":"Title Weight","type":"integer"},"tokenizer_revision":{"const":"bm25-han-bigram-v1","default":"bm25-han-bigram-v1","title":"Tokenizer Revision","type":"string"}},"title":"BaselineConfig","type":"object"}
