{"b":0.75,"body_jaccard":0.95,"config_revision":"pr3-baselines-v1","grouping_revision":"conservative-v1","k1":1.2,"metric_k":5,"min_body_tokens":12,"query_revision":"persona-query-v1","random_seed":0,"retrieval_sha256":"da0a382d1094914c1b8a0d373760fa6ede39e571690ef910445c59a50989127d","score_decimals":5,"title_jaccard":0.8,"title_weight":2,"tokenizer_revision":"bm25-han-bigram-v1"}
